{
  "unbaked": 0,
  "output": { "kind": "image", "width": 800, "height": 800 },
  "assets": {},
  "layers": [
    { "id": "g", "type": "group", "layers": [
      { "id": "a", "type": "solid", "color": "#ff0000", "width": 100, "height": 100,
        "start_ms": 0, "end_ms": 2000, "out": { "type": "fade", "duration_ms": 500 },
        "transform": { "x": { "keys": [ { "t_ms": 0, "v": 0 }, { "t_ms": 1000, "v": 700 } ] } } }
    ] }
  ]
}
