{
  "unbaked": 0,
  "output": { "kind": "audio", "width": 1280, "height": 720, "fps": "25", "duration_ms": 5000 },
  "assets": { "talk": { "path": "assets/talk.mp4" } },
  "layers": [ { "id": "picture", "type": "video", "asset": "talk", "width": 1280 } ],
  "audio": [ { "id": "sound", "asset": "talk" } ]
}
